{
  "schema_version": "1",
  "provenance": {
    "source": "bench #14",
    "plan": "docs/planning/2026-07-16-per-phase-model-routing.md \u00a71",
    "note": "6-model GLM-5.2-judged evidence; owner-approved rev-3 seat table (E3/#426). Floors declared for the enforcement seats (review/build); intake/plan/ship floors deferred (the engine does not gate on floor). design is now a static row (#464) whose DISPATCH remains competitive (bake-off owns it, E5/#428). Per-seat capability manifests and the top-level policy section land with #464 (W1, epic #475). #558 AC2: per-call max_budget_usd on every claude-bearing seat (analysis/ship 2.0, review/plan/intake/design 5.0, build 10.0 \u2014 multiples of the observed 1.48 per-dispatch cost proxy; plain config, #473 retunes); codex-only bounds keep timeout_s as THE compensating bound (AC-B4 as amended D-13). OWNER RETUNE 2026-07-24: seat table set to the owner's explicitly specified primary/effort/chain matrix \u2014 claude-opus-4-8 retired in favour of claude-opus-5 everywhere it appeared; intake/analysis/plan primaries moved to claude-opus-5 with effort high; analysis and plan chains normalised to fable-5 -> sonnet-5 (plan's gpt-5.6-terra fallback dropped). design/build/review/ship/offload primaries unchanged."
  },
  "policy": {
    "enforced_roles": [
      "review",
      "build"
    ]
  },
  "pools": {
    "claude": {
      "concurrency": 2
    },
    "codex": {
      "concurrency": 4
    },
    "zhipu": {
      "concurrency": 2
    },
    "hermes": {
      "concurrency": 1
    }
  },
  "seats": {
    "intake": {
      "manifest": {
        "session_policy": "fresh",
        "tool_grants": [
          "read"
        ],
        "effort": "high",
        "confinement": {
          "anthropic": "hooks"
        },
        "bounds": {
          "timeout_s": 900,
          "max_budget_usd": 5.0
        }
      },
      "primary": {
        "model": "claude-opus-5",
        "lane": {
          "provider": "anthropic",
          "transport": "native",
          "auth_mode": "subscription_oauth",
          "credential_ref": null,
          "pool": "claude"
        }
      },
      "chain": [
        {
          "model": "claude-fable-5",
          "lane": {
            "provider": "anthropic",
            "transport": "native",
            "auth_mode": "subscription_oauth",
            "credential_ref": null,
            "pool": "claude"
          }
        },
        {
          "model": "claude-sonnet-5",
          "lane": {
            "provider": "anthropic",
            "transport": "native",
            "auth_mode": "subscription_oauth",
            "credential_ref": null,
            "pool": "claude"
          }
        }
      ]
    },
    "analysis": {
      "manifest": {
        "session_policy": "fresh",
        "tool_grants": [
          "read"
        ],
        "effort": "high",
        "confinement": {
          "anthropic": "hooks"
        },
        "bounds": {
          "timeout_s": 1200,
          "max_budget_usd": 2.0
        }
      },
      "primary": {
        "model": "claude-opus-5",
        "lane": {
          "provider": "anthropic",
          "transport": "native",
          "auth_mode": "subscription_oauth",
          "credential_ref": null,
          "pool": "claude"
        }
      },
      "chain": [
        {
          "model": "claude-fable-5",
          "lane": {
            "provider": "anthropic",
            "transport": "native",
            "auth_mode": "subscription_oauth",
            "credential_ref": null,
            "pool": "claude"
          }
        },
        {
          "model": "claude-sonnet-5",
          "lane": {
            "provider": "anthropic",
            "transport": "native",
            "auth_mode": "subscription_oauth",
            "credential_ref": null,
            "pool": "claude"
          }
        }
      ]
    },
    "design": {
      "manifest": {
        "session_policy": "fresh",
        "tool_grants": [
          "read"
        ],
        "effort": "high",
        "confinement": {
          "openai": "codex-sandbox-readonly",
          "anthropic": "hooks"
        },
        "bounds": {
          "timeout_s": 1800,
          "max_budget_usd": 5.0
        }
      },
      "primary": {
        "model": "gpt-5.6-sol",
        "lane": {
          "provider": "openai",
          "transport": "native",
          "auth_mode": "subscription_oauth",
          "credential_ref": null,
          "pool": "codex"
        }
      },
      "chain": [
        {
          "model": "claude-opus-5",
          "lane": {
            "provider": "anthropic",
            "transport": "native",
            "auth_mode": "subscription_oauth",
            "credential_ref": null,
            "pool": "claude"
          }
        }
      ]
    },
    "plan": {
      "manifest": {
        "session_policy": "fresh",
        "tool_grants": [
          "read"
        ],
        "effort": "high",
        "confinement": {
          "anthropic": "hooks",
          "openai": "codex-sandbox-readonly"
        },
        "bounds": {
          "timeout_s": 1800,
          "max_budget_usd": 5.0
        }
      },
      "primary": {
        "model": "claude-opus-5",
        "lane": {
          "provider": "anthropic",
          "transport": "native",
          "auth_mode": "subscription_oauth",
          "credential_ref": null,
          "pool": "claude"
        }
      },
      "chain": [
        {
          "model": "claude-fable-5",
          "lane": {
            "provider": "anthropic",
            "transport": "native",
            "auth_mode": "subscription_oauth",
            "credential_ref": null,
            "pool": "claude"
          }
        },
        {
          "model": "claude-sonnet-5",
          "lane": {
            "provider": "anthropic",
            "transport": "native",
            "auth_mode": "subscription_oauth",
            "credential_ref": null,
            "pool": "claude"
          }
        }
      ]
    },
    "build": {
      "floor": 76,
      "role": "build",
      "manifest": {
        "session_policy": "fresh",
        "tool_grants": [
          "read",
          "edit",
          "bash"
        ],
        "effort": "high",
        "confinement": {
          "anthropic": "hooks",
          "openai": "codex-sandbox-pinned"
        },
        "bounds": {
          "timeout_s": 3600,
          "max_budget_usd": 10.0
        }
      },
      "primary": {
        "model": "claude-sonnet-5",
        "lane": {
          "provider": "anthropic",
          "transport": "native",
          "auth_mode": "subscription_oauth",
          "credential_ref": null,
          "pool": "claude"
        }
      },
      "chain": [
        {
          "model": "claude-opus-5",
          "lane": {
            "provider": "anthropic",
            "transport": "native",
            "auth_mode": "subscription_oauth",
            "credential_ref": null,
            "pool": "claude"
          }
        },
        {
          "model": "gpt-5.6-terra",
          "lane": {
            "provider": "openai",
            "transport": "native",
            "auth_mode": "subscription_oauth",
            "credential_ref": null,
            "pool": "codex"
          }
        }
      ]
    },
    "review": {
      "floor": 80,
      "role": "review",
      "manifest": {
        "session_policy": "fresh",
        "tool_grants": [
          "read"
        ],
        "effort": "high",
        "confinement": {
          "anthropic": "hooks",
          "openai": "codex-sandbox-readonly"
        },
        "bounds": {
          "timeout_s": 1800,
          "max_budget_usd": 5.0
        }
      },
      "primary": {
        "model": "claude-fable-5",
        "lane": {
          "provider": "anthropic",
          "transport": "native",
          "auth_mode": "subscription_oauth",
          "credential_ref": null,
          "pool": "claude"
        }
      },
      "chain": [
        {
          "model": "gpt-5.6-sol",
          "lane": {
            "provider": "openai",
            "transport": "native",
            "auth_mode": "subscription_oauth",
            "credential_ref": null,
            "pool": "codex"
          }
        },
        {
          "model": "claude-sonnet-5",
          "lane": {
            "provider": "anthropic",
            "transport": "native",
            "auth_mode": "subscription_oauth",
            "credential_ref": null,
            "pool": "claude"
          }
        }
      ]
    },
    "ship": {
      "manifest": {
        "session_policy": "fresh",
        "tool_grants": [
          "read"
        ],
        "effort": "medium",
        "confinement": {
          "anthropic": "hooks"
        },
        "bounds": {
          "timeout_s": 900,
          "max_budget_usd": 2.0
        }
      },
      "primary": {
        "model": "claude-sonnet-5",
        "lane": {
          "provider": "anthropic",
          "transport": "native",
          "auth_mode": "subscription_oauth",
          "credential_ref": null,
          "pool": "claude"
        }
      },
      "chain": [
        {
          "model": "claude-opus-5",
          "lane": {
            "provider": "anthropic",
            "transport": "native",
            "auth_mode": "subscription_oauth",
            "credential_ref": null,
            "pool": "claude"
          }
        },
        {
          "model": "claude-fable-5",
          "lane": {
            "provider": "anthropic",
            "transport": "native",
            "auth_mode": "subscription_oauth",
            "credential_ref": null,
            "pool": "claude"
          }
        }
      ]
    },
    "offload": {
      "manifest": {
        "session_policy": "fresh",
        "tool_grants": [
          "read"
        ],
        "effort": "medium",
        "confinement": {
          "nousresearch": "gateway-api-key + activation-gate (unsandboxed-refused); NOT an OS sandbox",